Nombre,Calificación,Número de Reseñas,Etiquetas
Fénix Travel & Tours,"5,0",1,"Excelente servicio, cumplimiento y calidad. La pasé muy bien en Tolima de la mano de esta agencia, me preparó todo el..."
Camaleon Travel,"5,0",2,"Que experiencia tan chevere, tienen una manera muy diferente de desarrollar las actividades, se siente uno parte del..."
Palomar Travel,N/A,0,"Palomar Travel, apostándole al turismo local, nace este proyecto dirigido por jovenes locales, cuyo principal objetivo es analizar el potencial turístico de la región Anzóategui Tolima, y así poder…"
Los Andariegos Turismo,N/A,0,"Somos una Agencia de Viajes Operadora de los destinos turismos a Nivel Nacional, con RNT 13890. Ubicada en la ciudad de Ibagué - Tolima la cual cuenta con el Centro de Operación en la Ciudad de Medell…"
Tolima BioDiversa Expediciones,N/A,0,Abierto ahora
Pa' Viajar Colombia,N/A,0,Somos una empresa Ibaguereña apasionados y con ganas de mostrar lo mejor de cada región. Nuestra especialidad es brindar experiencias personalizadas a través de un buen servicio. ¡Vamos Pa' Viajar…
Xcala Travel,"5,0",1,"Experiencias significativas en Tolima, organizaron la logistica del tour, la pasamos muy bien con mi familia y..."
Circuitos Colombia,"5,0",2,"Circuitos Colombia es un proyecto cuya finalidad es dar a conocer la riqueza de nuestro país a turistas extranjeros, por medio de unos circuitos previamente organizados por las diferentes regiones…"
Corporación Colombia Mágica,"5,0",1,"Increíbles experiencias excelente atención y servicio. Me contestaron rapido, atendieron mis solicitudes y nos fue muy..."
Comerciatur,"5,0",1,"Norbey fue un excelente anfirtrion, su servicio, amabilidad y todo lo que hizo para hacernos sentir como en casa y como..."
Senderismo Por Colombia,N/A,0,"Somos una agencia de viajes operadora de turismo de la Ciudad de Ibagué, Tolima, somos especialistas en viajes con programas exclusivos, dentro de los principales atractivos turísticos de Colombia…"
Vive Viajando Tours Ibagué,N/A,0,Agencia De Viajes Y Agencia De Viajes Operadora RNT: 23136 whatsapp :3142641677 Ibague BRR Ricaute parte alta
Memories anda Travel,N/A,0,"Somos una agencia de viajes creada por jóvenes amantes del turismo, nuestro objetivo, es brindar siempre la mejor opción a nuestros clientes para que vivan una experiencia única y memorable."
Voyage Company,N/A,0,"Luchamos contra las “barreras” que nos impiden viajar por el mundo, enfocándonos en cumplir los sueños vacacionales a las personas, ayudando en el desarrollo turístico y ecológico de nuestro país …"
Bici Tour Colombia,"1,0",1,Colombia
